Type,StartPos,EndPos,Text,EssayID,EssayLength
Argumentative,503,575,we should attach more importance to cooperation during primary education,essay001,2232
Argumentative,2154,2231,a more cooperative attitudes towards life is more profitable in one's success,essay001,2232
Argumentative,591,714,"through cooperation, children can learn about interpersonal skills which are significant in the future life of all students",essay001,2232
Argumentative,716,851,"What we acquired from team work is not only how to achieve the same goal with others but more importantly, how to get along with others",essay001,2232
Argumentative,853,1086,"During the process of cooperation, children can learn about how to listen to opinions of others, how to communicate with others, how to think comprehensively, and even how to compromise with other team members when conflicts occurred",essay001,2232
Argumentative,1088,1191,All of these skills help them to get on well with other people and will benefit them for the whole life,essay001,2232
Argumentative,1332,1376,competition makes the society more effective,essay001,2232
Argumentative,1212,1301,the significance of competition is that how to become more excellence to gain the victory,essay001,2232
Argumentative,1387,1492,"when we consider about the question that how to win the game, we always find that we need the cooperation",essay001,2232
Argumentative,1549,1846,"Take Olympic games which is a form of competition for instance, it is hard to imagine how an athlete could win the game without the training of his or her coach, and the help of other professional staffs such as the people who take care of his diet, and those who are in charge of the medical care",essay001,2232
Argumentative,1927,1992,"without the cooperation, there would be no victory of competition",essay001,2232
Non-Argumentative,0,53,Should students be taught to compete or to cooperate?,essay001,2232
Non-Argumentative,54,140,It is always said that competition can effectively promote the development of economy.,essay001,2232
Non-Argumentative,141,283,"In order to survive in the competition, companies continue to improve their products and service, and as a result, the whole society prospers.",essay001,2232
Non-Argumentative,284,454,"However, when we discuss the issue of competition or cooperation, what we are concerned about is not the whole society, but the development of an individual's whole life.",essay001,2232
Non-Argumentative,455,501,"From this point of view, I firmly believe that",essay001,2232
Non-Argumentative,576,589,"First of all,",essay001,2232
Non-Argumentative,1192,1210,"On the other hand,",essay001,2232
Non-Argumentative,1302,1330,Hence it is always said that,essay001,2232
Non-Argumentative,1377,1385,"However,",essay001,2232
Non-Argumentative,1493,1547,"The greater our goal is, the more competition we need.",essay001,2232
Non-Argumentative,1847,1915,The winner is the athlete but the success belongs to the whole team.,essay001,2232
Non-Argumentative,1916,1925,Therefore,essay001,2232
Non-Argumentative,1993,2152,"Consequently, no matter from the view of individual development or the relationship between competition and cooperation we can receive the same conclusion that",essay001,2232
Argumentative,391,489,they are able to sustain their cultural identities and doing so help they keep their origin values,essay002,2078
Argumentative,1936,2077,sustaining the traditions will make the immigrated people keep their cultural identity and give them confident among the many culture society,essay002,2078
Argumentative,500,624,maintaining one’s cultural identity is a key important rule to help individuals emerge in the new multicultural environments,essay002,2078
Argumentative,1089,1156,sustaining the cultural values of immigrants is paramount essential,essay002,2078
Argumentative,626,839,"Take Australia for example, immigrants from varieties of nations have a day called multicultural day where people from each country prepare their food and traditional activities for displaying in the public venues",essay002,2078
Argumentative,841,946,"Many Australians come this day to enjoy the shows, learn about the cultures and admire the diverse values",essay002,2078
Argumentative,948,1057,"These feedbacks, in turn, help raise one’s pride of their cultures and help people understand each other more",essay002,2078
Argumentative,1168,1204,it is crucial to keep one’s identity,essay002,2078
Argumentative,1209,1307,they need a connection back to their country as well as teach their children their value of origin,essay002,2078
Argumentative,1711,1795,keeping the cultural traditions in the destination countries is tremendous important,essay002,2078
Argumentative,1323,1412,children immigrated to a new country will face social troubles in school with new friends,essay002,2078
Argumentative,1414,1571,"In this new environment, parent should find friends coming from their same country so that they can socialize in a very familiar manner as feeling being home",essay002,2078
Argumentative,1573,1685,"Fail to create this familiarity makes them felt isolated, in the extreme can lead to social disorder like autism",essay002,2078
Argumentative,1819,1908,there are opposing ideas of neglecting one’s cultural values to adapt in the new cultures,essay002,2078
Non-Argumentative,0,145,"More people are migrating to other countries than ever before

The last 50 years have seen an increasing number of immigrants to other countries.",essay002,2078
Non-Argumentative,146,234,"People moved due to a number of reasons, namely better educations or higher salary jobs.",essay002,2078
Non-Argumentative,235,358,Some people thought that they should follow the local customs in order to integrate into their adopted countries’ cultures.,essay002,2078
Non-Argumentative,359,390,However I strongly believe that,essay002,2078
Non-Argumentative,490,498,"Firstly,",essay002,2078
Non-Argumentative,1058,1087,Thus this makes it clear that,essay002,2078
Non-Argumentative,1157,1166,"Secondly,",essay002,2078
Non-Argumentative,1205,1208,for,essay002,2078
Non-Argumentative,1308,1321,"For instance,",essay002,2078
Non-Argumentative,1686,1709,"Hence, it is clear that",essay002,2078
Non-Argumentative,1796,1817,"To conclude, although",essay002,2078
Non-Argumentative,1909,1934,"As far as I am concerned,",essay002,2078
Argumentative,352,475,it has contributed to the economic development as well as preserved the culture and environment of the tourist destinations,essay003,1789
Argumentative,1568,1701,international tourism has both triggered economic development and maintained cultural and environment values of the tourist countries,essay003,1789
Argumentative,955,1012,tourism has clearly improved lives in the tourist country,essay003,1789
Argumentative,487,613,international tourism promotes many aspects of the destination country’s economy in order to serve various demands of tourists,essay003,1789
Argumentative,615,784,"Take Cambodia for example, a large number of visitors coming to visit the Angkowat ancient temple need services like restaurants, hotels, souvenir shops and other stores",essay003,1789
Argumentative,786,943,These demands trigger related business in the surrounding settings which in turn create many jobs for local people improve infrastructure and living standard,essay003,1789
Argumentative,1024,1135,"through tourism industry, many cultural values have been preserved and natural environments have been protected",essay003,1789
Argumentative,1454,1526,tourism has survived many non-tangible cultural values and beauty scenes,essay003,1789
Argumentative,1151,1329,"in Vietnam, many cultural costumes and natural scenes, namely ‘Trong Dong’ drum performance and ‘Ha Long’ bay, are being encouraged to preserve and funded by the tourism ministry",essay003,1789
Argumentative,1331,1446,"Without this support and profit from tourism, many traditional cultures would disappear due to its low income works",essay003,1789
Non-Argumentative,0,217,"International tourism is now more common than ever before

The last decade has seen an increasing number of tourists traveling to visit natural wonder sights, ancient heritages and different cultures around the world.",essay003,1789
Non-Argumentative,218,351,"While some people might think that this international tourism has negative effects on the destination countries, I would contend that",essay003,1789
Non-Argumentative,476,484,"Firstly,",essay003,1789
Non-Argumentative,944,953,Therefore,essay003,1789
Non-Argumentative,1013,1022,"Secondly,",essay003,1789
Non-Argumentative,1136,1149,"For instance,",essay003,1789
Non-Argumentative,1447,1452,"Thus,",essay003,1789
Non-Argumentative,1527,1565,"To conclude, as far as I am concerned,",essay003,1789
Non-Argumentative,1702,1788,"In addition, the authorities should adequately support these sustainable developments.",essay003,1789
Argumentative,374,459,newspapers have lost their competitive advantage to sustain their prolonged existence,essay007,2452
Argumentative,1090,1175,the print media has failed to keep its important role in the provision of information,essay007,2452
Argumentative,554,650,"to obtain information, using the internet is quicker and more convenient than reading newspapers",essay007,2452
Argumentative,652,888,"Contrary to the past when people had to wait long hours to take a daily newspaper, nowadays, they can acquire latest news updated every second through their mobile phones or computers connected to the internet, everywhere and at anytime",essay007,2452
Argumentative,890,1081,"As can be seen, these devices and machines are very common in all parts of the world, making it easier for people to read a number of things that newspapers can not provide in only some pages",essay007,2452
Argumentative,1706,1838,"the number of people reading newspapers may continue falling sharply, possibly leading to the close-downs of many in the coming time",essay007,2452
Argumentative,1200,1324,"from the economic aspect, buying newspapers appears to be a waste of money when the internet becomes available for every one",essay007,2452
Argumentative,1356,1439,the internet service is being provided at a low cost or even free in many countries,essay007,2452
Argumentative,1624,1687,"The answer, perhaps, is that hardly would rational people do so",essay007,2452
Argumentative,2107,2188,newspapers' production will have to face environmentalists on its way to be alive,essay007,2452
Argumentative,1861,1993,"when taking environment into consideration, people must conceive that the more newspapers are published, the more trees are cut down",essay007,2452
Argumentative,1995,2090,This is simply the contributor to the deforestation which is happening all over the world today,essay007,2452
Non-Argumentative,0,43,Will newspapers become a thing of the past?,essay007,2452
Non-Argumentative,44,157,"The internet has been more and more popular for recent years, providing people with a huge source of information.",essay007,2452
Non-Argumentative,158,271,"As a result of this, print media such as newspapers have experienced a dramatic decline in the number of readers.",essay007,2452
Non-Argumentative,272,372,"Some people, however, still believe that they can exist for long time; others disagree, arguing that",essay007,2452
Non-Argumentative,460,538,"Personally, I am inclined to agree with the latter view for following reasons.",essay007,2452
Non-Argumentative,539,552,"First of all,",essay007,2452
Non-Argumentative,1082,1088,"Hence,",essay007,2452
Non-Argumentative,1176,1198,"Another point is that,",essay007,2452
Non-Argumentative,1325,1354,It is clear to recognize that,essay007,2452
Non-Argumentative,1440,1622,"The question arises as to whether or not a person spends an extra money buying newspapers to receive the same, even usually less information than those he can have with the internet?",essay007,2452
Non-Argumentative,1688,1704,"For this reason,",essay007,2452
Non-Argumentative,1839,1859,"Last, but not least,",essay007,2452
Non-Argumentative,2091,2105,"At this point,",essay007,2452
Non-Argumentative,2189,2305,"In conclusion, it might be unpleasant for some advocating newspapers to witness the extinction of the type of media.",essay007,2452
Non-Argumentative,2306,2451,"However, this, if occurring, should be seen as a result of the ever-increasing innovations in media technology and in our modern life as a whole.",essay007,2452
Argumentative,468,539,a government is supposed to offer sufficient financial support for both,essay008,2044
Argumentative,1909,1993,a government should spare effort on young children education as well as universities,essay008,2044
Argumentative,1995,2043,both are crucial on the way to a brighter future,essay008,2044
Argumentative,960,1167,"if countries, especially the developing countries, are determined to take off, one of the key points governments should set on agenda is to educate more qualified future citizens through elementary education",essay008,2044
Argumentative,776,942,"a lack of well-established primary education goes hand in hand with a high rate of illiteracy, and this interplay seriously compromises a country's future development",essay008,2044
Argumentative,557,687,"elementary education, like the base of a architecture, is the fundamental requirement to be a qualified citizen in today's society",essay008,2044
Argumentative,689,771,government should guarantee that all people have equal and convenient access to it,essay008,2044
Argumentative,1687,1840,government's big budget on universities may attract more excellent intellectuals and researchers into the country and enjoy a higher reputation worldwide,essay008,2044
Argumentative,1605,1672,Researches into humanities and art still need large amount of money,essay008,2044
Argumentative,1188,1331,"for higher education, which represent the cutting edge of a country's academic achievements, act as the vanguard in economic and social advance",essay008,2044
Argumentative,1333,1487,The high technology and new ideas applied into practice may not only lead a country to flourish but also elevate its status in the international community,essay008,2044
Argumentative,1489,1573,Some may argue that universities can support themselve well by donation or invention,essay008,2044
Argumentative,1579,1603,this argument is invalid,essay008,2044
Non-Argumentative,0,54,"Government budget focus, young children or university?",essay008,2044
Non-Argumentative,55,254,"""Education is the investment in our future"", as Senator Bernie Sanders once pointed out, education, which fosters a civilized society, plays a significant role in a country's long-lasting prosperity.",essay008,2044
Non-Argumentative,255,355,It is no wonder that governments throughout the world lay special emphasis on education development.,essay008,2044
Non-Argumentative,356,466,"As for the two integral components within the system, elementary and advanced education, there's no doubt that",essay008,2044
Non-Argumentative,540,555,Concerning that,essay008,2044
Non-Argumentative,772,774,So,essay008,2044
Non-Argumentative,943,958,"In other words,",essay008,2044
Non-Argumentative,1168,1186,"That's not enough,",essay008,2044
Non-Argumentative,1574,1577,but,essay008,2044
Non-Argumentative,1673,1685,"what's more,",essay008,2044
Non-Argumentative,1841,1907,"From reasons listed above, we can safely draw the conclusion that,",essay008,2044
Argumentative,1633,1720,"Consideration and communication, in my personal opinion, are the most important quality",essay009,1899
Argumentative,315,374,the most important quality of roommates is being considered,essay009,1899
Argumentative,393,465,communication is also another essential particularity of a good roommate,essay009,1899
Argumentative,468,517,Consideration is always important in relationship,essay009,1899
Argumentative,532,596,roommate turns down the music or television volume at night time,essay009,1899
Argumentative,598,684,Sometimes we will not know what we have done until we have a taste of our own medicine,essay009,1899
Argumentative,686,830,"At all times, think about the other's feeling before doing any self-centered action would help to improve the roommate relationship tremendously",essay009,1899
Argumentative,843,918,having a considered roommate is significantly imperative to our school life,essay009,1899
Argumentative,920,1004,It will not only prevent conflicts but also to have a friend or even a family member,essay009,1899
Argumentative,1016,1063,communication is as well making a good roommate,essay009,1899
Argumentative,1456,1549,"Through communication, bonded are build and we could have better understanding of each others",essay009,1899
Argumentative,1380,1411,communication is very important,essay009,1899
Argumentative,1065,1147,"People have different habit in daily life, such as tidy the blanket in the morning",essay009,1899
Argumentative,1149,1237,One might think this is a piece of cake while other would consider it as immense project,essay009,1899
Argumentative,1239,1367,If one requested to move out just because his roommate do not tidy up the blanket in the morning might be crying over split milk,essay009,1899
Argumentative,1415,1454,it would clear up the misinterpretation,essay009,1899
Non-Argumentative,0,150,"Roommates quality and their importance

Much has been said about the importance about good roommates and how roommates will affect our life in school.",essay009,1899
Non-Argumentative,151,290,Research showed that friends that we made in university are more likely to be life time friends and this especially applicable to roommate.,essay009,1899
Non-Argumentative,291,314,"In my personal opinion,",essay009,1899
Non-Argumentative,375,391,"In the meantime,",essay009,1899
Non-Argumentative,518,530,"For example,",essay009,1899
Non-Argumentative,831,841,"Therefore,",essay009,1899
Non-Argumentative,1005,1014,"Moreover,",essay009,1899
Non-Argumentative,1368,1378,"Therefore,",essay009,1899
Non-Argumentative,1412,1414,as,essay009,1899
Non-Argumentative,1550,1631,"In conclusion, there are many valuable factors about roommate that are important.",essay009,1899
Non-Argumentative,1721,1779,"However, people might not get what they want all the time.",essay009,1899
Non-Argumentative,1780,1847,The sky is the limit; there are all kinds of personality out there.,essay009,1899
Non-Argumentative,1848,1898,We need to be flexible to be account into society.,essay009,1899
Argumentative,328,397,"governments spend more money on buses, trains, and subways investment",essay010,2210
Argumentative,484,578,they help alleviate traffic congestion and decrease the amount of carbon released into the air,essay010,2210
Argumentative,399,473,Such public vehicles are used to serve a large number of people in society,essay010,2210
Argumentative,1244,1353,the policy that concentrates money on developing public transportation brings an advantageous impact on earth,essay010,2210
Argumentative,1086,1231,"if there are more good buses, trains, or subways, people are inclined to use less private vehicles, which decreases the amount of carbon released",essay010,2210
Argumentative,637,713,carbon emission cut is significantly essential for protecting the atmosphere,essay010,2210
Argumentative,732,820,"the more cars and motorbikes are on roads, the more seriously the ozone layer is damaged",essay010,2210
Argumentative,822,945,"If governments use more money to improve roads, there is a strong likelihood that more people drive their private cars work",essay010,2210
Argumentative,947,1075,"This is sure to lead to more carbon emitted into the atmosphere, which can cause skin cancer and destroy the natural environment",essay010,2210
Argumentative,1554,1607,there are a great number of vehicles flowing on roads,essay010,2210
Argumentative,1432,1513,It is quiet clear that traffic congestion is a serious problem in many big cities,essay010,2210
Argumentative,1641,1732,governments have to turn people' attention on public vehicles to reduce cars and motorbikes,essay010,2210
Argumentative,1734,1853,There is the possibility that improving roads and highways does not seem to reach the major cause of traffic congestion,essay010,2210
Argumentative,1369,1430,the policy would play a pivotal part in relieving traffic jam,essay010,2210
Argumentative,1891,1952,high-quality roads and highways make it easier to move around,essay010,2210
Argumentative,1968,2033,public transportation systems even have more important advantages,essay010,2210
Argumentative,2035,2097,They not only ease traffic jam but also protect the atmosphere,essay010,2210
Non-Argumentative,0,127,"Should governments spend more money on improving roads and highways

Nowadays transportation has attracted much social concern.",essay010,2210
Non-Argumentative,128,281,Whether governments should invest more money in traffic infrastructure or focus more on developing public transportation has erupted endless controversy.,essay010,2210
Non-Argumentative,282,327,It does not seem unreasonable to suggest that,essay010,2210
Non-Argumentative,474,483,therefore,essay010,2210
Non-Argumentative,579,615,Both these two things are important.,essay010,2210
Non-Argumentative,616,635,"First and foremost,",essay010,2210
Non-Argumentative,714,730,The fact is that,essay010,2210
Non-Argumentative,1076,1084,"Whereas,",essay010,2210
Non-Argumentative,1232,1242,"Obviously,",essay010,2210
Non-Argumentative,1354,1366,"In addition,",essay010,2210
Non-Argumentative,1514,1552,The main reason for this issue is that,essay010,2210
Non-Argumentative,1608,1639,"In order to tackle the problem,",essay010,2210
Non-Argumentative,1854,1889,"In conclusion, I would concede that",essay010,2210
Non-Argumentative,1953,1966,"Nevertheless,",essay010,2210
Non-Argumentative,2098,2209,That is why many governments around the world invest more money on developing public transportation facilities.,essay010,2210
Argumentative,147,199,the physical education part should not be outweighed,essay011,2241
Argumentative,201,350,"Physical exercises help to create healthy nation, assist to learning through direct observation and finally aid to financial development of a country",essay011,2241
Argumentative,2111,2240,"the more attention is withdrawn to a problem of physical education, the more influence we can get on academic success of students",essay011,2241
Argumentative,795,938,"if the entire nation, from their school ages begin going for sports and try doing that everyday, eventually it may help to build healthy nation",essay011,2241
Argumentative,446,484,healthy body is basis for healthy soul,essay011,2241
Argumentative,486,581,There is a direct linkage between people's health and the frequency of doing physical exercises,essay011,2241
Argumentative,583,623,"The more we practice, the better we feel",essay011,2241
Argumentative,639,789,"there is a fact that one can improve health conditions with everyday physical activity: gradually, step by step we change physical condition to better",essay011,2241
Argumentative,949,1027,"when we practice outdoors and indoors sports, many aspects are getting clearer",essay011,2241
Argumentative,1042,1147,"when a person goes jogging everyday, eventually he can understand his own body through direct observation",essay011,2241
Argumentative,1156,1322,the school basketball team gains more knowledge on how to succeed in some particular kind of throwing the ball into hoot practicing rather than learning theoretically,essay011,2241
Argumentative,1337,1446,"almost all natural science discoveries were made by direct observation, which is a part of physical education",essay011,2241
Argumentative,1470,1554,financial sustainability of a region mostly depends on how healthy the population is,essay011,2241
Argumentative,1570,1657,the money invested into physical education program can save allocations into healthcare,essay011,2241
Argumentative,1665,1700,the nation is comparatively healthy,essay011,2241
Argumentative,1719,1808,physically healthy people can contribute more both into economical and social development,essay011,2241
Argumentative,1831,1884,"the better a person feels, the better his brain works",essay011,2241
Argumentative,1897,2007,putting physical activities in early steps of human development would finally lead to mentally healthy society,essay011,2241
Argumentative,2018,2065,it ends up with financially competitive country,essay011,2241
Non-Argumentative,0,146,"Physical exercise

Although some people think that the major part of school schedule should be entirely devoted to academics, I truly believe that",essay011,2241
Non-Argumentative,351,443,"First of all, the ancient Latin proverb says: ""Anima sana in corpore sano"", which means that",essay011,2241
Non-Argumentative,624,637,"Additionally,",essay011,2241
Non-Argumentative,790,793,"So,",essay011,2241
Non-Argumentative,939,947,"Besides,",essay011,2241
Non-Argumentative,1028,1040,"For example,",essay011,2241
Non-Argumentative,1148,1154,"Alike,",essay011,2241
Non-Argumentative,1323,1335,"Furthermore,",essay011,2241
Non-Argumentative,1447,1467,"Last, but not least,",essay011,2241
Non-Argumentative,1555,1568,"For instance,",essay011,2241
Non-Argumentative,1658,1663,since,essay011,2241
Non-Argumentative,1701,1717,"Along with that,",essay011,2241
Non-Argumentative,1809,1829,"As a matter of fact,",essay011,2241
Non-Argumentative,1885,1895,"Therefore,",essay011,2241
Non-Argumentative,2008,2016,As hence,essay011,2241
Non-Argumentative,2066,2109,"In the conclusion, I would like to say that",essay011,2241
Argumentative,390,467,email can be count as one of the most beneficial results of modern technology,essay012,1981
Argumentative,469,696,"Many years ago, peoples had to pay a great deal of money to post their letters, and their payements were related to the weight of their letters or boxes, and many accidents may cause problem that the post could not be delivered",essay012,1981
