Type,StartPos,EndPos,Text,EssayID,EssayLength
Argumentative,776,918,"the industrial exhaust gases are adulterating the air, causing the insalubrious phenomenon such as acid rain, global warming or climate change",essay200,2186
Argumentative,929,978,people are draining the Earth's natural resources,essay200,2186
Argumentative,980,1042,"These resources such as oil, coal are vital for human activity",essay200,2186
Argumentative,1054,1178,"nowadays, the exploitation activities of these resources are increasing dramatically to adapt to the infinite need of people",essay200,2186
Argumentative,1180,1334,"Researchers indicated that most of natural resources are un-recyclable and only several decades after, the Earth's natural resources are totally exhausted",essay200,2186
Argumentative,1336,1432,"At that time, human activity will be seriously affected due to the dependence on these resources",essay200,2186
Argumentative,1440,1482,people are endangering other species' live,essay200,2186
Argumentative,1484,1548,Hunting has been a fundamental activity of human for having food,essay200,2186
Argumentative,1550,1742,"Through million years of hunting, especially in recent centuries with the innovation of rifle and dynamite, people have killed many animals and even have made some kinds of them become extinct",essay200,2186
Argumentative,1754,1833,"people, suffering from the population pressure, are expanding their living area",essay200,2186
Argumentative,1849,1890,the living area of other species narrowed,essay200,2186
Argumentative,1892,1976,This narrowing of living region is pushing many creatures to the brink of extinction,essay200,2186
Argumentative,2035,2081,human activity are gradually destroy the Earth,essay200,2186
Argumentative,2088,2185,"it is polluting the Earth environment, depleting the resource and imperiling other species' lives",essay200,2186
Non-Argumentative,0,163,"Some people believe that the Earth is being harmed by human

Whether human activity is making the Earth a better place to live or damaging it is a debatable issue.",essay200,2186
Non-Argumentative,164,257,Some people advocate the idea that human activity is advantageously influencing to the Earth.,essay200,2186
Non-Argumentative,258,290,"However, I strongly believe that",essay200,2186
Non-Argumentative,348,351,for,essay200,2186
Non-Argumentative,762,774,"Furthermore,",essay200,2186
Non-Argumentative,919,927,"Besides,",essay200,2186
Non-Argumentative,1043,1052,therefore,essay200,2186
Non-Argumentative,1433,1438,"Also,",essay200,2186
Non-Argumentative,1743,1752,"Moreover,",essay200,2186
Non-Argumentative,1834,1847,"consequently,",essay200,2186
Non-Argumentative,1977,2033,"All in all, from discussed reasons, we can conclude that",essay200,2186
Non-Argumentative,2082,2087,since,essay200,2186
Argumentative,1920,2003,supporting art will benefit the human beings and the company in short-term interest,essay201,2068
Argumentative,2005,2067,I still hold the environment protection for long-term interest,essay201,2068
Argumentative,271,330,conservation is more urgent now than at any time in history,essay201,2068
Argumentative,1037,1106,supporting environment protection will benefit the company eventually,essay201,2068
Argumentative,1492,1544,conservation leads us to a higher standard of living,essay201,2068
Argumentative,1118,1183,an increasing amount of people pay more attention to conservation,essay201,2068
Argumentative,1196,1261,sponsoring conservation is a more efficient method of advertising,essay201,2068
Argumentative,1263,1481,"Just imagine if the project your company is sponsoring effectively improves the environment, then your company would be known as an environmentally-friendly company and benefit from it in this consumer-oriented society",essay201,2068
Argumentative,332,553,"According to a statistic conducted by the International Animal Preserving Association, we have only ten percent of the animals that have ever existed, which means that the biodiversity of our home is grievously endangered",essay201,2068
Argumentative,568,684,"rising sea levels, caused by global warming, have reached a level that is threatening human's life in many countries",essay201,2068
Argumentative,686,910,"If we continue discharging carbon dioxide with non-environmentally friendly cars, nations like Japan will be submerged and weather patterns could change, causing flooding, drought, and an increasing amount of damaging storms",essay201,2068
Argumentative,922,1022,"the ecosystem is in its worst condition ever and if we didn't take harsh measures now, we never will",essay201,2068
Argumentative,1561,1617,art is one of the best ways of entertaining human beings,essay201,2068
Argumentative,1624,1741,"with exhaust fumes and acid rain, we do not have the energy and enthusiasm to appreciate the paintings or photographs",essay201,2068
Argumentative,1743,1898,Biodiversity and a more beautiful nature are not only the results of abetter environment but also are the necessities of photography and other types of art,essay201,2068
Non-Argumentative,0,262,"Spending money on supporting art or protecting environment

If I had the opportunity to help a company make a decision on spending money either on supporting the arts or helping the environment, I would choose the latter without hesitation for the reasons below.",essay201,2068
Non-Argumentative,263,269,"First,",essay201,2068
Non-Argumentative,554,566,"What's more,",essay201,2068
Non-Argumentative,911,920,"In short,",essay201,2068
Non-Argumentative,1023,1035,"Furthermore,",essay201,2068
Non-Argumentative,1107,1116,"Nowadays,",essay201,2068
Non-Argumentative,1184,1194,"therefore,",essay201,2068
Non-Argumentative,1482,1490,"Finally,",essay201,2068
Non-Argumentative,1545,1559,I confess that,essay201,2068
Non-Argumentative,1618,1622,"but,",essay201,2068
Non-Argumentative,1899,1918,"To sum up, although",essay201,2068
Argumentative,244,297,it is one's hard work that helps him reach his target,essay203,2444
Argumentative,125,192,I do not see any rational in believing in luck to reach one's goals,essay203,2444
Argumentative,2273,2295,it is good to be lucky,essay203,2444
Argumentative,2297,2341,depending on luck for everything is not good,essay203,2444
Argumentative,2349,2443,I strongly believe in hard working that would not easily disappoint you as luck sometimes does,essay203,2444
Argumentative,306,390,"if you depend only on luck for all your accomplishments, you are taking a great risk",essay203,2444
Argumentative,392,478,Luck is something intangible and no one can guarantee that it would ever come your way,essay203,2444
Argumentative,480,534,"If it doesn't work, it would be a great disappointment",essay203,2444
Argumentative,687,750,"all my accomplishments were backed by my hard work, not my luck",essay203,2444
Argumentative,756,817,I never did encounter any disappointments of missing my goals,essay203,2444
Argumentative,544,658,"if you strive hard to achieve what you want, then your hard work would take you at least closer to your final goal",essay203,2444
Argumentative,936,1033,those who believe in hard work are clear about their goals and know about their final destination,essay203,2444
Argumentative,1035,1169,They carefully organize the process of achieving their targets and continue to evaluate their progress until they reach the final goal,essay203,2444
Argumentative,1171,1244,"If you believe in luck, you would be clueless about where you are heading",essay203,2444
Argumentative,1259,1399,"a friend of mine, who had severe financial constraints, had the habit of buying lottery tickets thinking that one day he would win a lottery",essay203,2444
Argumentative,1401,1486,He was living in an illusion that he can solve his financial issues with this lottery,essay203,2444
Argumentative,1497,1576,up to this day his luck has not appeared and problems have got further worsened,essay203,2444
Argumentative,1588,1700,"if you work hard, luck too might shine on you and take you some more steps further ahead from your actual target",essay203,2444
Argumentative,1715,1758,my boss worked tirelessly for his promotion,essay203,2444
Argumentative,1760,1829,He looked at every aspect that he needed to qualify for the promotion,essay203,2444
Argumentative,1831,1938,He realized that having a master's degree would be a great credential for him to outperform his competitors,essay203,2444
Argumentative,1949,2065,"he had many commitments at home and work, he somehow managed to complete this degree before he was eligible to apply",essay203,2444
Argumentative,2067,2195,At the end he was not only able to get the promotion amidst a stiff competition but also got nominated for a foreign scholarship,essay203,2444
Argumentative,2202,2261,he had more credentials than other officers in his capacity,essay203,2444
Non-Argumentative,0,115,"Luck vs hard work

There are many instances that luck has brought people things that they never could even imagine.",essay203,2444
Non-Argumentative,116,124,"However,",essay203,2444
Non-Argumentative,193,242,Therefore I strongly agree with the argument that,essay203,2444
Non-Argumentative,298,304,"First,",essay203,2444
Non-Argumentative,535,542,Instead,essay203,2444
Non-Argumentative,659,685,"In my personal experience,",essay203,2444
Non-Argumentative,751,754,And,essay203,2444
Non-Argumentative,818,918,"Secondly, if you believe that hard work is the key to success, it would make you a visionary person.",essay203,2444
Non-Argumentative,919,934,"In other words,",essay203,2444
Non-Argumentative,1245,1257,"For example,",essay203,2444
Non-Argumentative,1487,1495,"However,",essay203,2444
Non-Argumentative,1577,1585,"Thirdly,",essay203,2444
Non-Argumentative,1701,1713,"For example,",essay203,2444
Non-Argumentative,1939,1947,Although,essay203,2444
Non-Argumentative,2196,2201,since,essay203,2444
Non-Argumentative,2262,2270,Although,essay203,2444
Non-Argumentative,2342,2347,Hence,essay203,2444
Argumentative,463,508,students should be free not to attend classes,essay205,2641
Argumentative,517,627,it improves the quality of student life as well as their learning motivation and teaches important life skills,essay205,2641
Argumentative,2411,2476,it is clear that going to classes should be optional for students,essay205,2641
Argumentative,2478,2640,I hold this belief due to the improvement of students' current experience as well as the valuable skills and knowledge they obtain for their whole life afterwards,essay205,2641
Argumentative,867,959,"some students might learn better at home on their own, for instance, by reading the textbook",essay205,2641
Argumentative,961,1020,This problem occurs especially if the lecturer is lethargic,essay205,2641
Argumentative,1022,1121,By letting students choose not to attend class you give them the opportunity to escape bad teaching,essay205,2641
Argumentative,1128,1217,they are able to save precious study time and dive into the course syllabus independently,essay205,2641
Argumentative,1232,1327,being free to stay away from classes improves flexibility and therefore quality of student life,essay205,2641
Argumentative,1329,1461,Sometimes the wild party on Thursday night is too good to end already at midnight only because of a lecture on Friday in the morning,essay205,2641
Argumentative,1463,1606,With a liberal policy students are able to postpone the learning to the afternoon which gives a feeling of freedom and improves time efficiency,essay205,2641
Argumentative,1608,1734,"Research has shown that the more satisfied the students are with those life aspects, the better they perform in academic areas",essay205,2641
Argumentative,1940,2046,Intrinsic motivation is known to be much more desirable because it leads to better learning and well-being,essay205,2641
Argumentative,2154,2312,By giving students the freedom to choose about class attendance they might rather be thinking about why they decided to study and learn to motivate themselves,essay205,2641
Argumentative,2314,2396,These are crucial skills for the duration of their study and their whole life time,essay205,2641
Argumentative,2057,2152,in order to gain intrinsic motivation students need to become aware of their strengths and aims,essay205,2641
Non-Argumentative,0,46,Should students be required to attend classes?,essay205,2641
Non-Argumentative,47,142,The issue at hand is whether it should be obligatory for university students to attend classes.,essay205,2641
Non-Argumentative,143,231,This is an interesting question because it affects a great amount of students worldwide.,essay205,2641
Non-Argumentative,232,302,Nonetheless there are various different policies regarding this topic.,essay205,2641
Non-Argumentative,303,441,An important aspect might be whether one desires to optimize the learned knowledge or the amount of valuable experiences for the students.,essay205,2641
Non-Argumentative,442,461,"However, to my mind",essay205,2641
Non-Argumentative,509,516,because,essay205,2641
Non-Argumentative,628,671,"Firstly, a liberal policy is very feasible.",essay205,2641
Non-Argumentative,672,726,Checking for attendance requires a lot of bureaucracy.,essay205,2641
Non-Argumentative,727,807,Especially for larger classes it is impossible to check for everybody to attend.,essay205,2641
Non-Argumentative,808,855,So an optional attendance saves time and money.,essay205,2641
Non-Argumentative,856,865,"Secondly,",essay205,2641
Non-Argumentative,1122,1126,Thus,essay205,2641
Non-Argumentative,1218,1230,"In addition,",essay205,2641
Non-Argumentative,1735,1785,"Finally, psychology knows two types of motivation.",essay205,2641
Non-Argumentative,1786,1850,There is intrinsic motivation which comes from your own mindset.,essay205,2641
Non-Argumentative,1851,1938,And there is extrinsic motivation which comes from the praise and laud of other people.,essay205,2641
Non-Argumentative,2047,2055,"However,",essay205,2641
Non-Argumentative,2397,2409,"To conclude,",essay205,2641
Argumentative,258,296,I would prefer to live in a small town,essay206,2019
Argumentative,301,401,"I think a small town has some advantages, such as good weather, a healthy life and better facilities",essay206,2019
Argumentative,1568,1600,I prefer to live in a small town,essay206,2019
Argumentative,1613,1737,"it has some advantages such as less stress, because of better weather conditions and also, better relationship within a town",essay206,2019
Argumentative,1739,1821,In small town people know each other and have better deal together than big cities,essay206,2019
Argumentative,1832,1898,on big cities people feel alone and depress more than small cities,essay206,2019
Argumentative,1935,2018,people in small town have more happiness and friendship and less illness and stress,essay206,2019
Argumentative,412,512,the first advantage of living in a small town is a healthy life that we can obtain due to many items,essay206,2019
Argumentative,514,626,One of the conditions that helps us to be healthy is good weather and less population that exist in a small town,essay206,2019
Argumentative,634,689,in a small town there are less crowded and less traffic,essay206,2019
Argumentative,691,870,Living in a place with less pollution such as air pollution or sound pollution helps us to have a healthier life and one of the main consequences is less stress and more happiness,essay206,2019
Argumentative,882,995,in a small town foods and materials we need are healthier than in big cities and there are fresh foods and fruits,essay206,2019
Argumentative,1028,1100,it is obvious that living in small towns is healthier than in big cities,essay206,2019
Argumentative,1112,1160,another advantage of small towns is living costs,essay206,2019
Argumentative,1162,1289,"Living cost is one of the important concerns in every society and then, in a small town living cost is fewer than in big cities",essay206,2019
Argumentative,1302,1364,in a small town we can live in big houses with good landscapes,essay206,2019
Argumentative,1371,1443,because of less crowded spaces we have more facilities and more services,essay206,2019
Argumentative,1445,1516,Transportation cost is less than in big cities and we have less traffic,essay206,2019
Argumentative,1525,1551,we can save time and money,essay206,2019
Non-Argumentative,0,137,"Living in smal towns

Place of living has the most significant affect on our lives and we have to choose it according to several factors.",essay206,2019
Non-Argumentative,138,257,"Some people prefer to live in tall buildings and crowded areas, whereas others prefer to live in a small and calm town.",essay206,2019
Non-Argumentative,297,300,and,essay206,2019
Non-Argumentative,402,410,"Firstly,",essay206,2019
Non-Argumentative,627,632,"Also,",essay206,2019
Non-Argumentative,871,880,"Moreover,",essay206,2019
Non-Argumentative,996,1026,"Regardless of some exceptions,",essay206,2019
Non-Argumentative,1101,1110,"Secondly,",essay206,2019
Non-Argumentative,1290,1300,"Therefore,",essay206,2019
Non-Argumentative,1365,1369,also,essay206,2019
Non-Argumentative,1517,1524,so that,essay206,2019
Non-Argumentative,1552,1566,"In conclusion,",essay206,2019
Non-Argumentative,1601,1612,and I think,essay206,2019
Non-Argumentative,1822,1831,therefore,essay206,2019
Non-Argumentative,1899,1933,However it is an obvious fact that,essay206,2019
Argumentative,1472,1521,young people tend to study or work in urban areas,essay207,1738
Argumentative,1528,1599,these provide them many educational opportunities and career potentials,essay207,1738
Argumentative,1625,1737,I do not approve of this trend due to negative effects such as low quality of life and affecting the environment,essay207,1738
Argumentative,376,456,cities often offer more well-paid jobs and study chances compared to rural areas,essay207,1738
Argumentative,601,709,they move to big cities to pursue academic career and find jobs in order to have a higher standard of living,essay207,1738
Argumentative,469,589,many large companies and universities often locate in cities which are hailed as promising lands to develop their career,essay207,1738
Argumentative,724,926,"if a gradate stays in the city after leaving his college and seeks a job with good salary instead of returning his village to do farm work, he could perhaps buy a house or his own car after a short time",essay207,1738
Argumentative,1159,1279,cities cannot provide adequate space for thousands of dwellers that might lead to poor housing conditions and sanitation,essay207,1738
Argumentative,1028,1144,the burgeoning number of young adults from the countryside flocking to cities gives rise to overpopulation in cities,essay207,1738
Argumentative,1295,1333,it might put strain on the environment,essay207,1738
Argumentative,1335,1455,"If there are more people in the cities, there would be large numbers of vehicles on the road, which causes air pollution",essay207,1738
Non-Argumentative,0,172,"Young people move to cities

These days, there are increasing numbers of young people from the countryside moving to cities in search of jobs and educational opportunities.",essay207,1738
Non-Argumentative,173,290,"Personally, I think it has some drawbacks that will be discussed in this essay together with some reasons about this.",essay207,1738
Non-Argumentative,291,375,"To begin with, the major cause that leads to urban migration of young adults is that",essay207,1738
Non-Argumentative,457,467,"Obviously,",essay207,1738
Non-Argumentative,590,599,Therefore,essay207,1738
Non-Argumentative,710,722,"For example,",essay207,1738
Non-Argumentative,927,998,"However, this phenomenon sometimes poses several negative consequences.",essay207,1738
Non-Argumentative,999,1025,There can be no doubt that,essay207,1738
Non-Argumentative,1145,1157,"As a result,",essay207,1738
Non-Argumentative,1280,1293,"Additionally,",essay207,1738
Non-Argumentative,1456,1470,"In conclusion,",essay207,1738
Non-Argumentative,1522,1527,since,essay207,1738
Non-Argumentative,1600,1623,"In my opinion, however,",essay207,1738
Argumentative,325,353,it will take some time on it,essay208,1624
Argumentative,355,415,high school students should take a course on basic economics,essay208,1624
Argumentative,471,526,it can provide students a sense of direction in academy,essay208,1624
Argumentative,528,653,"Basic economic class can help the students touch the surface of this field, let them to know what this subject mainly discuss",essay208,1624
Argumentative,655,745,That will help the students cultivate their own interest and a sense of career orientation,essay208,1624
Argumentative,756,807,students may study harder for their economic dreams,essay208,1624
Argumentative,829,870,economy is always correlate with politics,essay208,1624
Argumentative,872,1030,"students can study specialized knowledge along with some Politian status, which may open their vision toward the nation and don't get limited in the textbooks",essay208,1624
Argumentative,1041,1109,there is also an intimate connection between economy and enterprises,essay208,1624
Argumentative,1111,1168,students can also gain knowledge more practical and vivid,essay208,1624
Argumentative,1183,1264,the basic economic course can also help with the students when they go to college,essay208,1624
Argumentative,1266,1435,"They may feel more readily to learn the knowledge in this field and save much time, with that they are able to study more efficiently and more deeply than other students",essay208,1624
Argumentative,1437,1533,That as well would provide the students with more confidence and let them become more compatible,essay208,1624
Argumentative,1572,1623,I suggest the basic course of economic is necessary,essay208,1624
Non-Argumentative,0,135,"Basic economic class can help the students touch the surface of this field

In today's community, economy becomes the order of the day.",essay208,1624
Non-Argumentative,136,216,Getting to know the theory in this area seems really important for our students.,essay208,1624
Non-Argumentative,217,288,"Then, the earlier we jump into this area, the more skillful we will be.",essay208,1624
Non-Argumentative,289,324,"Thus, in my point of view, although",essay208,1624
Non-Argumentative,416,444,Let me explain it in detail.,essay208,1624
Non-Argumentative,445,469,"For the primary concern,",essay208,1624
Non-Argumentative,746,754,"Finally,",essay208,1624
Non-Argumentative,808,826,"On the other hand,",essay208,1624
Non-Argumentative,1031,1039,"Besides,",essay208,1624
Non-Argumentative,1169,1181,"In addition,",essay208,1624
Non-Argumentative,1534,1570,"Considering all those factors above,",essay208,1624
Argumentative,1406,1460,it will yield more negative results than positive ones,essay209,1530
Argumentative,1473,1529,it should be made available for a wide range of learners,essay209,1530
Argumentative,916,1041,"it should be up for grabs for a majority of young people, who wish to pursue their passion as well as develop comprehensively",essay209,1530
Argumentative,790,903,university is not just about academic studies but also a place to nurture artistic talent and develop soft skills,essay209,1530
Argumentative,1058,1160,there is a tendency for social vices to rise if university is to be restricted to only the best people,essay209,1530
Argumentative,1162,1327,"Apart from the disheartened ones, many devoiding of neccessary preparations are likely to be recipes for failure when applying for jobs, mostly the white-collar ones",essay209,1530
Argumentative,375,468,outstanding academic students are eligible for university due to their intellectual advantage,essay209,1530
Argumentative,485,631,"such abstract or complicated informatin, easily absorbed by those students, may prove as a matter of pressure for those who lack equivalent skills",essay209,1530
Argumentative,642,693,it is undeniable that one deserves what he has done,essay209,1530
Argumentative,695,779,University is like a gift presented to those who have gone to great length to attain,essay209,1530
Non-Argumentative,0,68,"University education restriction

Universtiy is an entrance to life.",essay209,1530
Non-Argumentative,69,129,It equips us with a package of wisdom and virtue to succeed.,essay209,1530
Non-Argumentative,130,296,It is the importance of university that raises a question whether students with best scholastic performance deserve university study or just any young wishful people.,essay209,1530
Non-Argumentative,297,359,Both sides are to be discussed before a conclusion is reached.,essay209,1530
Non-Argumentative,360,374,"To begin with,",essay209,1530
Non-Argumentative,469,483,"To be precise,",essay209,1530
Non-Argumentative,632,640,"Besides,",essay209,1530
Non-Argumentative,780,788,"However,",essay209,1530
Non-Argumentative,904,914,"Therefore,",essay209,1530
Non-Argumentative,1042,1055,"What is more,",essay209,1530
Non-Argumentative,1328,1389,"In conclusion, university restriction has both pros and cons.",essay209,1530
Non-Argumentative,1390,1404,"In my opinion,",essay209,1530
Non-Argumentative,1461,1471,That's why,essay209,1530
Argumentative,1619,1812,a greater proportion of the budget should be allotted to education and prevention issues in comparison with treatment due to achieve more effective health system and greater level of well-being,essay210,1813
Argumentative,274,387,governments should devote a greater portion of their health budgets to health education and means for precautions,essay210,1813
Argumentative,410,524,education and preventative measures should receive a greater budget is the potential improvements in health system,essay210,1813
Argumentative,541,723,decreasing the number of patients in the health system can lead hospitals and healthcare centers to be managed effectively which will result in better treatments for current patients,essay210,1813
