Type,StartPos,EndPos,Text,EssayID,EssayLength
Argumentative,674,773,most of them will be forced to take up careers which are poles apart from what they had studied for,essay101,2768
Argumentative,803,1060,"a medical graduate might find it very disheartened when he had to spend around five precious years studying medicine and at the end of the day, he will have to take up another profession rather than doctor due to the insufficient job opportunities available",essay101,2768
Argumentative,1078,1247,"due to the lack of genuine passion on the work which was not of their option, there is a greater possibility for their performance standard to dwindle at their workplace",essay101,2768
Argumentative,1803,1892,"it would indeed be better if at an older age, opportunities are given to the younger ones",essay101,2768
Argumentative,1266,1309,not all elderly workers are physically well,essay101,2768
Argumentative,1311,1485,"Beyond that age, a large proportion of them have an elevated chance of contracting a multitude of health problems such as stress related diseases and cardiovascular illnesses",essay101,2768
Argumentative,1507,1594,the stressful life that an aged teacher goes through will definitely take a toll on him,essay101,2768
Argumentative,1610,1677,they will not be able to give their best in whatever they are doing,essay101,2768
Argumentative,1688,1795,"the academic institution will have to pay for his medical bills, resulting in more loss for the institution",essay101,2768
Argumentative,2370,2434,it is indeed evident that age limit should be set for retirement,essay101,2768
Argumentative,1906,1988,the expertise of the senior workers who had retired should never be underestimated,essay101,2768
Argumentative,1990,2152,"Their invaluable experiences and knowledge in their respective fields such as engineering, medicine, and law can certainly be beneficial to the younger generation",essay101,2768
Argumentative,2161,2353,it is highly recommended that the retiree come over to the companies or hospitals to have regular sessions with the present staffs to bridge the gap between them and to pass on their knowledge,essay101,2768
Non-Argumentative,0,40,Should people be forced to stop working?,essay101,2768
Non-Argumentative,41,142,The appropriate age at which a person should stop working is now a much debated issue in the society.,essay101,2768
Non-Argumentative,143,267,Some opine that people should be given the option to choose when they want to call it a day while others oppose this notion.,essay101,2768
Non-Argumentative,268,297,"In my personal point of view,",essay101,2768
Non-Argumentative,366,377,"I, for one,",essay101,2768
Non-Argumentative,479,529,due to several reasons that I shall discuss below.,essay101,2768
Non-Argumentative,530,549,"First and foremost,",essay101,2768
Non-Argumentative,660,672,"As a result,",essay101,2768
Non-Argumentative,774,801,"To illustrate this further,",essay101,2768
Non-Argumentative,1061,1076,"On top of that,",essay101,2768
Non-Argumentative,1248,1264,"Apart from that,",essay101,2768
Non-Argumentative,1486,1505,"To cite an example,",essay101,2768
Non-Argumentative,1595,1608,"Consequently,",essay101,2768
Non-Argumentative,1678,1686,"Besides,",essay101,2768
Non-Argumentative,1796,1801,"Thus,",essay101,2768
Non-Argumentative,1893,1904,"Admittedly,",essay101,2768
Non-Argumentative,2153,2159,"Hence,",essay101,2768
Non-Argumentative,2354,2368,"In conclusion,",essay101,2768
Non-Argumentative,2435,2615,There will come a certain time when the older generation should hand over the responsibility to the fresh comers who are certainly waiting to be given a choice to prove themselves.,essay101,2768
Non-Argumentative,2616,2767,"After all, retirement not only marks the end of an individual, but also gives him a chance to make up for what he has lost throughout his working life.",essay101,2768
Argumentative,34,90,public museums and art galleries will still be necessary,essay102,1756
Argumentative,104,158,we can see the art works and historical objects online,essay102,1756
Argumentative,239,282,the Internet really brings them convenience,essay102,1756
Argumentative,401,450,pictures online are only limited to a screen size,essay102,1756
Argumentative,465,562,the exhibits in museums or galleries are all life size and visitors can get a more direct felling,essay102,1756
Argumentative,1578,1617,we still need museums and art galleries,essay102,1756
Argumentative,1622,1755,computers can be introduced to museums and galleries in order to help visitors to know more about the art works or historical objects,essay102,1756
Argumentative,577,636,"only when we see the real mummy, can we experience mystique",essay102,1756
Argumentative,160,230,Most people nowadays prefer to use the Internet to search for art work,essay102,1756
Argumentative,284,342,We can browse the art work from all over the world at home,essay102,1756
Argumentative,353,394,people may not get a spiritual experience,essay102,1756
Argumentative,638,781,"In order to help visitors to learn more about the exhibits, museums hold various activities which make visitors be part of what they are seeing",essay102,1756
Argumentative,796,903,"at American Museum of Natural History, you can make a bone-by-bone reproduction of the museum's stegosaurus",essay102,1756
Argumentative,905,1006,"at Museum of Art in New York, you can look at 17th century instruments while listening to their music",essay102,1756
Argumentative,1008,1095,"While if you ""visit"" the museum online, you may not able to get this kind of experience",essay102,1756
Argumentative,1097,1183,Seeing an art work on computer screen is not the same as you watch it by your own eyes,essay102,1756
Argumentative,1199,1302,you can't see the texture of the artwork which is very important to study the skills used by the artist,essay102,1756
Argumentative,1317,1387,not all the details of the artwork can be shown on the computer screen,essay102,1756
Argumentative,1389,1414,Some details might be dim,essay102,1756
Argumentative,1421,1474,the resolution ratio of the screen is not high enough,essay102,1756
Argumentative,1476,1551,These may influence the comprehension of the art work or historical objects,essay102,1756
Non-Argumentative,0,22,Are museums necessary?,essay102,1756
Non-Argumentative,23,32,I believe,essay102,1756
Non-Argumentative,91,102,even though,essay102,1756
Non-Argumentative,231,238,because,essay102,1756
Non-Argumentative,343,351,"However,",essay102,1756
Non-Argumentative,395,400,since,essay102,1756
Non-Argumentative,451,463,"By contrast,",essay102,1756
Non-Argumentative,563,575,"For example,",essay102,1756
Non-Argumentative,782,794,"For example,",essay102,1756
Non-Argumentative,1184,1197,"For instance,",essay102,1756
Non-Argumentative,1303,1315,"What's more,",essay102,1756
Non-Argumentative,1415,1420,since,essay102,1756
Non-Argumentative,1552,1576,"In conclusion, I believe",essay102,1756
Non-Argumentative,1618,1621,but,essay102,1756
Argumentative,1719,1803,"I disagree with reducing the cost of medicines, which may exacerbate their qualities",essay105,1957
Argumentative,727,798,The reduction in cost of medicines therefore shows the sign of humanity,essay105,1957
Argumentative,630,725,"If people in poorer countries gain access to these drugs, their health situations may be better",essay105,1957
Argumentative,327,385,more lives will be saved by the use of effective medicines,essay105,1957
Argumentative,387,476,The medical industry in developing countries is incapable of producing high-quality drugs,essay105,1957
Argumentative,478,628,"With advanced technology, the developed world has achieved remarkable breakthroughs in making medicines, which can cure a variety of serious illnesses",essay105,1957
Argumentative,1381,1430,there are other measures to improve the situation,essay105,1957
Argumentative,1432,1570,It is advisable for the government to encourage medical production by supplying land for building factories and reducing part of the taxes,essay105,1957
Argumentative,1586,1702,charitable organizations can buy medicines from developed countries and distribute to the undeveloped world for free,essay105,1957
Argumentative,809,905,"the current cost of medicines is , in fact, reasonable and based on the medicines' effectiveness",essay105,1957
Argumentative,919,1020,"the process of researching, testing and producing drugs in masses costs a substantial amount of money",essay105,1957
Argumentative,1032,1086,these products prove to ensure human health completely,essay105,1957
Argumentative,1241,1322,"the measure cannot be adopted, otherwise those companies will go into liquidation",essay105,1957
Argumentative,1088,1228,"Suppose companies were forced to reduce the cost of drugs, they would make no profit, even running up debt because of production expenditure",essay105,1957
Non-Argumentative,0,40,Should the cost of medicines be reduced?,essay105,1957
Non-Argumentative,41,184,"At present, a large number of patients in poor countries are suffering from deaths caused by lack of medication rather than dangerous diseases.",essay105,1957
Non-Argumentative,185,313,It is suggested that companies in developed countries ought to reduce their price of medicines to avoid such unnecessary deaths.,essay105,1957
Non-Argumentative,314,325,"Admittedly,",essay105,1957
Non-Argumentative,799,807,"However,",essay105,1957
Non-Argumentative,906,917,"Apparently,",essay105,1957
Non-Argumentative,1021,1030,"Moreover,",essay105,1957
Non-Argumentative,1229,1239,"Therefore,",essay105,1957
Non-Argumentative,1323,1366,"In short, this is not a long-term solution.",essay105,1957
Non-Argumentative,1367,1379,"Fortunately,",essay105,1957
Non-Argumentative,1571,1584,"Additionally,",essay105,1957
Non-Argumentative,1703,1717,"In conclusion,",essay105,1957
Non-Argumentative,1804,1956,"Instead, the government and medical foundations should be responsible for the distribution of drugs to the undeveloped world at a more reasonable price.",essay105,1957
Argumentative,1488,1639,the effort to prohibit people from smoking in public area is certainly helping in curtailing the associated health risks and to create a healthy nation,essay106,1770
Argumentative,299,395,the move will do more good by looking at the quality of health and image of a nation in long run,essay106,1770
Argumentative,862,961,the number of fatality can be significantly reduced if a total ban on public smoking is implemented,essay106,1770
Argumentative,406,561,it is well known and clinically proven that smoking is extremely hazardous to the smoker and others who have been exposed to the fume over a period of time,essay106,1770
Argumentative,563,700,Recent death statistic released by the Malaysian Ministry of Health shows that the top killer was lung related diseases caused by smoking,essay106,1770
Argumentative,702,849,A large proportion of death involved second hand smoker particularly young children and pregnant women who were vulnerable to these lethal diseases,essay106,1770
Argumentative,973,1101,the image of a healthy nation can be promoted when government restricts public smoking by imposing stern penalty to the offender,essay106,1770
Argumentative,1391,1475,This example shows the benefit of restricting public smoking to a country as a whole,essay106,1770
Argumentative,1117,1242,"the Brunei government had recently enforced a law against smoking in public areas such as cafés, hospital and shopping street",essay106,1770
Argumentative,1244,1389,"This step has curbed down the numbers of smokers in the country and as a result, Brunei remains a place known for its tranquility and cleanliness",essay106,1770
Non-Argumentative,0,24,Prohibit public smoking?,essay106,1770
Non-Argumentative,25,156,The awareness on harmful effects from smoking among the general public has put much pressure on the government and private sectors.,essay106,1770
Non-Argumentative,157,279,"As a result, some businesses prohibit smoking in their premises and even some governments restrict smoking in public area.",essay106,1770
Non-Argumentative,280,297,It is agreed that,essay106,1770
Non-Argumentative,396,404,"Firstly,",essay106,1770
Non-Argumentative,850,860,"Therefore,",essay106,1770
Non-Argumentative,962,971,"Secondly,",essay106,1770
Non-Argumentative,1102,1115,"For instance,",essay106,1770
Non-Argumentative,1476,1486,"To sum up,",essay106,1770
Non-Argumentative,1640,1769,It is hoped that more businesses and governments will follow the same initiatives for the interest of the people and the country.,essay106,1770
Argumentative,311,343,concerns to save Earth are vital,essay107,1764
Argumentative,377,458,rapid development of infrastructure is eating most of the forest throughout world,essay107,1764
Argumentative,1485,1529,Earth is our home and it should be protected,essay107,1764
Argumentative,460,537,The so-called Concrete jungles have evolved endangering forests and wild life,essay107,1764
Argumentative,554,637,life saving oxygen is produced by trees after converting harmful carbon dioxide gas,essay107,1764
Argumentative,649,723,wild life is very essential to maintain ecological balance on planet Earth,essay107,1764
Argumentative,735,839,large emissions of carbon monoxide gas from refrigerants like air conditioners have depleted ozone layer,essay107,1764
Argumentative,841,938,Importance of ozone layer is evident by the fact as it protects us from harmful ultra violet rays,essay107,1764
Argumentative,954,1154,excess emission of carbon dioxide gas mainly by vehicles around the world has increased the average temperature at north pole which in turn has increased water level due to gradual melting of glaciers,essay107,1764
Argumentative,1164,1259,either industrial waste or domestic waste produced everyday is badly polluting the planet Earth,essay107,1764
Argumentative,1274,1376,a large amount of unnoticed industrial waste released in oceans effects aquatic life to a large extent,essay107,1764
Argumentative,1378,1470,Harmful chemicals present in industrial waste kills lot of sea creatures in oceans or rivers,essay107,1764
Non-Argumentative,0,128,"Human activities are harming the Earth

""Save the planet Earth"" is a common line which can be read and heard all over the world.",essay107,1764
Non-Argumentative,129,227,There has been a lot of initiatives to protect the planet Earth from unbridled human developments.,essay107,1764
Non-Argumentative,228,310,"Although some people argue these developments are making our life comfortable, but",essay107,1764
Non-Argumentative,344,367,due to various reasons.,essay107,1764
Non-Argumentative,368,376,"Firstly,",essay107,1764
Non-Argumentative,538,552,As we all know,essay107,1764
Non-Argumentative,638,647,"Moreover,",essay107,1764
Non-Argumentative,724,733,"Secondly,",essay107,1764
Non-Argumentative,939,952,"To add to it,",essay107,1764
Non-Argumentative,1155,1162,"Lastly,",essay107,1764
Non-Argumentative,1260,1272,For instance,essay107,1764
Non-Argumentative,1471,1483,"To conclude,",essay107,1764
Non-Argumentative,1530,1647,Any human activity causing harm to Earth should be controlled and alternate ways should be devised to control damage.,essay107,1764
Non-Argumentative,1648,1763,Creative ideas should be encouraged to leave minimum environmental footprints without compromising quality of life.,essay107,1764
Argumentative,1679,1807,the government should regulate the correct amount of violent and sexual content and censor the culturally unsuitable information,essay109,1903
Argumentative,331,455,it should increase the level of control to protect the public against inappropriate contents and unsuitable foreign cultures,essay109,1903
Argumentative,457,562,One of the strong arguments in favour of tighter media control is to limit the violent and sexual content,essay109,1903
Argumentative,564,617,They have a serious impact on people in their puberty,essay109,1903
Argumentative,632,761,"an internet cartoon comedy called happy tree is extremely brutal, where the characters usually have their heads or limbs tear off",essay109,1903
Argumentative,797,952,television companies import foreign programmes from time to time and audiences might accept their ideas which maybe otherwise not welcomed to local culture,essay109,1903
Argumentative,954,1049,A few years ago there was a Japanese game show which involved throwing cream cakes to the loser,essay109,1903
Argumentative,1051,1099,This is actually very environmentally unfriendly,essay109,1903
Argumentative,1183,1316,"the government should disclose the information to the media in a timely manner, especially for disasters and outbreak of new diseases",essay109,1903
Argumentative,1318,1470,"Taking the SARS in 2003 as an example, the Chinese government limited the amount of information for public access which therefore causes numerous deaths",essay109,1903
Argumentative,1481,1567,another perspective on this is to prevent the citizen from unnecessary fear and unrest,essay109,1903
Non-Argumentative,0,38,Amount of control on media information,essay109,1903
Non-Argumentative,39,187,"Nowadays, one of the most controversial issues related to mass media is the correct amount of control posed on newspapers, televisions and websites.",essay109,1903
Non-Argumentative,188,296,It is argued that the government should exercise less restriction on sharing of media information to public.,essay109,1903
Non-Argumentative,297,329,"However, I strongly believe that",essay109,1903
Non-Argumentative,618,630,"For example,",essay109,1903
Non-Argumentative,762,795,Another supporting reason is that,essay109,1903
Non-Argumentative,1100,1165,The major opposing argument is to protect the safety of citizens.,essay109,1903
Non-Argumentative,1166,1181,"In other words,",essay109,1903
Non-Argumentative,1471,1479,"Even so,",essay109,1903
Non-Argumentative,1568,1612,Both sides of the arguments have its merits.,essay109,1903
Non-Argumentative,1613,1677,"My personal view is that despite the emphasis of citizen safety,",essay109,1903
Non-Argumentative,1808,1902,Setting up a council to monitor the media information to the public could be a practical idea.,essay109,1903
Argumentative,1488,1559,"being a citizen involves in a number of duties, other than paying taxes",essay110,1641
Argumentative,1561,1640,People in society must do more than paying taxes to contribute to their society,essay110,1641
Argumentative,548,591,they have fulfilled their duty as a citizen,essay110,1641
Argumentative,407,535,"If people are paying taxes, that means they are taking part in the development of their country as well as the country's economy",essay110,1641
Argumentative,296,405,Taxes are the income for every country in the world and they are extremely important for developing countries,essay110,1641
Argumentative,818,925,"the crime rate is reduced and society becomes a peaceful place, so the country will develop at a rapid pace",essay110,1641
Argumentative,616,700,individuals of a country are responsible for many other things apart from paying tax,essay110,1641
Argumentative,711,803,"in order to develop a country, citizens must obey laws, which were imposed by the government",essay110,1641
Argumentative,940,1015,being a citizen in society should protect the country's culture and history,essay110,1641
Argumentative,1031,1168,people should have knowledge about their own culture and history by studying at school with full concentration or reading them from books,essay110,1641
Argumentative,1189,1275,a person has to unite with other people in the community so as to develop their nation,essay110,1641
Argumentative,1285,1430,"if people in society have a strong bond with each other, society will become a peaceful place, where people are helping and sharing to each other",essay110,1641
Non-Argumentative,0,124,"Citizen's only responsibility is to pay taxes

There is a controversial debate around the world about the duties of citizen.",essay110,1641
Non-Argumentative,125,295,"Some people believe that paying tax is the only responsibility of citizens, while others disagree and think that being a person in society involves more responsibilities.",essay110,1641
Non-Argumentative,536,546,"Therefore,",essay110,1641
Non-Argumentative,592,614,Some people argue that,essay110,1641
Non-Argumentative,701,709,"In fact,",essay110,1641
Non-Argumentative,804,816,"In this way,",essay110,1641
Non-Argumentative,926,938,"Furthermore,",essay110,1641
Non-Argumentative,1016,1029,"For instance,",essay110,1641
Non-Argumentative,1169,1187,"On the other hand,",essay110,1641
Non-Argumentative,1276,1283,"Indeed,",essay110,1641
Non-Argumentative,1431,1486,"Taking everything into account, I strongly believe that",essay110,1641
Argumentative,339,391,primates should have the same rights as human beings,essay111,1734
Argumentative,1708,1733,it should be made illegal,essay111,1734
Argumentative,1631,1689,it seems to me that testing on animals has no clear result,essay111,1734
Argumentative,393,454,There are several reasons why animal testing should be banned,essay111,1734
Argumentative,465,496,the costs outweigh the benefits,essay111,1734
Argumentative,498,633,"Every year, cosmetic companies, farms or medical schools kill millions of animals to test their products, without any beneficial result",essay111,1734
Argumentative,635,683,Animal testing costs an enormous amount of money,essay111,1734
Argumentative,691,768,"they must be fed, cared for and treated with drugs or experimental substances",essay111,1734
Argumentative,1150,1206,sacrificing animals is an expensive and painful activity,essay111,1734
Argumentative,780,820,animals are kept in unnatural conditions,essay111,1734
Argumentative,822,935,"Recent studies point out that animals are neglected and treated poorly, which influences their reactions to drugs",essay111,1734
Argumentative,937,1121,"In March 2003, a lab technician shot a video inside a lab, which revealed primates in cages without pain medication, for instance one baboon with a metal cylinder screwed into its head",essay111,1734
Argumentative,1422,1478,animals and people's response to a drug can be different,essay111,1734
Argumentative,1506,1596,human beings have no moral right to use animals in ways that do not benefit the individual,essay111,1734
Argumentative,1335,1414,"it is not only inhumane and cruel to cause pain to animals, but also misleading",essay111,1734
Non-Argumentative,0,153,"Testing on animals and keeping them in unnatural conditions

Perhaps the most serious problem facing the animals' rights today is animal experimentation.",essay111,1734
Non-Argumentative,154,338,"Many medical treatments have been discovered by animal testing, including cancer and HIV drugs While most scientists claim that this is vital for improving human health, I believe that",essay111,1734
Non-Argumentative,455,463,"Firstly,",essay111,1734
Non-Argumentative,684,689,since,essay111,1734
Non-Argumentative,769,778,"Secondly,",essay111,1734
Non-Argumentative,1122,1148,"Consequently, I think that",essay111,1734
Non-Argumentative,1207,1310,There is also the argument that many ethical and genetic principles are broken when testing on animals.,essay111,1734
Non-Argumentative,1311,1333,Many people agree that,essay111,1734
Non-Argumentative,1415,1420,since,essay111,1734
Non-Argumentative,1479,1504,I personally believe that,essay111,1734
Non-Argumentative,1597,1629,"For the reasons mentioned above,",essay111,1734
Non-Argumentative,1690,1707,"and consequently,",essay111,1734
Argumentative,1531,1615,exams have a role to play in ensuring proper and objective assessment of achievement,essay112,1777
Argumentative,1626,1776,exams need to be carefully designed and supplemented with other forms of evaluation if they are to be a truly useful component of the education system,essay112,1777
Argumentative,349,386,There are clearly advantages to exams,essay112,1777
Argumentative,388,471,They help to ensure fairness by imposing the same conditions on all exam candidates,essay112,1777
Argumentative,473,645,"They are also relatively versatile; different types of exam questions, for example, multiple-choice questions and essay tasks, can test different sorts of reasoning ability",essay112,1777
Argumentative,656,686,exams also have some drawbacks,essay112,1777
Argumentative,688,791,Test-wise candidates can often perform well on exams without having good underlying knowledge or skills,essay112,1777
Argumentative,806,884,some test-takers perform cannot achieve a satisfying result because of anxiety,essay112,1777
Argumentative,900,1048,"teachers and learners focus only on theses aspects of the curriculum that are likely to be tested, thus narrowing the educational experience for all",essay112,1777
Argumentative,1050,1112,A number of measures should be taken to address these concerns,essay112,1777
Argumentative,1133,1206,exams should match the content and activities of the learning environment,essay112,1777
Argumentative,1208,1306,Exam task should be varied to give fair opportunities to candidates with different types of skills,essay112,1777
Argumentative,1308,1492,"Other types of assessment should also be considered, assignment writing, for example, to assess independent learning and research skills, or group projects, to measure teamwork ability",essay112,1777
Non-Argumentative,0,141,"""Pen and Paper"" Examination

Examinations are one of the most common methods of measuring learning in education systems throughout the world.",essay112,1777
Non-Argumentative,142,272,"At virtually every stage of the learning process, exams are used to verify that the learner is ready to move on to the next stage.",essay112,1777
Non-Argumentative,273,348,"However, many believe that the role of examinations should be reconsidered.",essay112,1777
Non-Argumentative,646,654,"However,",essay112,1777
Non-Argumentative,792,804,"In contrast,",essay112,1777
Non-Argumentative,885,898,"In this case,",essay112,1777
Non-Argumentative,1113,1131,"Wherever possible,",essay112,1777
