Type,StartPos,EndPos,Text,EssayID,EssayLength
Non-Argumentative,401,411,"Obviously,",essay293,2327
Non-Argumentative,697,718,The result shows that,essay293,2327
Non-Argumentative,975,984,"Secondly,",essay293,2327
Non-Argumentative,1071,1078,because,essay293,2327
Non-Argumentative,1220,1229,therefore,essay293,2327
Non-Argumentative,1325,1330,While,essay293,2327
Non-Argumentative,1416,1421,since,essay293,2327
Non-Argumentative,1535,1545,"Therefore,",essay293,2327
Non-Argumentative,1660,1671,"Admittedly,",essay293,2327
Non-Argumentative,1760,1768,Although,essay293,2327
Non-Argumentative,1836,1841,Since,essay293,2327
Non-Argumentative,1962,1967,While,essay293,2327
Non-Argumentative,2197,2211,"In conclusion,",essay293,2327
Non-Argumentative,2281,2288,because,essay293,2327
Argumentative,299,352,professors should be encouraged to mainly do research,essay294,2225
Argumentative,2030,2106,it is natural to support the professors spending more time on doing research,essay294,2225
Argumentative,2108,2224,"While extending the way of their own development, the outcomes of the researches will also benefit the whole society",essay294,2225
Argumentative,554,649,"by doing research, professors could catch up with the latest development of modern technologies",essay294,2225
Argumentative,479,539,The research projects provide communication with the outside,essay294,2225
Argumentative,368,429,doing research is a method of self-improvement for professors,essay294,2225
Argumentative,431,477,Universities are relatively fenced environment,essay294,2225
Argumentative,651,748,I still remembered that my professor took part in several research projects when I was in college,essay294,2225
Argumentative,750,805,He was often invited to do speech in other universities,essay294,2225
Argumentative,816,903,"my university is not in the high-ranking list, he gained a reputation by those projects",essay294,2225
Argumentative,905,965,The research projects like windows opened to the wider world,essay294,2225
Argumentative,1141,1219,you could not find another place with so much talent people gathering together,essay294,2225
Argumentative,1235,1313,there is really no reason to discourage professors from using those advantages,essay294,2225
Argumentative,1065,1133,It is very common to see state-of-the-art laboratories in the campus,essay294,2225
Argumentative,1315,1420,We all know that Einstein developed the theory of general relativity when he was a professor in HU Berlin,essay294,2225
Argumentative,1422,1480,Universities positively contribute the professors' success,essay294,2225
Argumentative,977,1063,professors should fully use the research-friendly environment provided by universities,essay294,2225
Argumentative,1503,1557,doing research could also improve the teaching quality,essay294,2225
Argumentative,1559,1675,"With the help of research projects, professors could lead their students into the practical world from the classroom",essay294,2225
Argumentative,1677,1746,They can easily teach students how to imply the knowledge in practice,essay294,2225
Argumentative,1748,1845,I still remembered the experience of being an assistant in one of my professor's research project,essay294,2225
Argumentative,1847,1944,"By participating in it, I had opportunities to use theories on textbooks in real life experiments",essay294,2225
Argumentative,1946,2008,The research project provides a more efficient way of teaching,essay294,2225
Non-Argumentative,0,53,Professors should do more research or teach students?,essay294,2225
Non-Argumentative,54,138,"These days, more and more university professors are involved in scientific research.",essay294,2225
Non-Argumentative,139,259,Some are afraid that this will lead to the decline of education quality and suggest them to spend more time on teaching.,essay294,2225
Non-Argumentative,260,297,"However, according to my experiences,",essay294,2225
Non-Argumentative,353,366,"First of all,",essay294,2225
Non-Argumentative,540,552,"In addition,",essay294,2225
Non-Argumentative,806,814,Although,essay294,2225
Non-Argumentative,966,975,"Secondly,",essay294,2225
Non-Argumentative,1134,1139,"Also,",essay294,2225
Non-Argumentative,1220,1233,"Consequently,",essay294,2225
Non-Argumentative,1481,1500,"Last but not least,",essay294,2225
Non-Argumentative,2009,2027,"For those reasons,",essay294,2225
Argumentative,499,559,I prefer to learn with a teacher rather than learn by myself,essay295,2162
Argumentative,1701,1741,being without a teacher has shortcomings,essay295,2162
Argumentative,1783,1932,"if someone faced so complicated confusion in his study and his many endeavors on making out it were miscarried, this might be ended in disappointment",essay295,2162
Argumentative,2098,2161,I support this point that the learning with a teacher is better,essay295,2162
Argumentative,1947,2090,"for one who depends on only himself in learning, his improvement of ability, with regard to cooperation and express his opinion, is unpromising",essay295,2162
Argumentative,699,858,"when we encounter difficulty in our study which we can not make out, that asking the difficulty from our teacher is propitious way for us to solve it instantly",essay295,2162
Argumentative,873,997,"professors and teachers have much experience and knowledge, and are so dextrous with letting students understand their study",essay295,2162
Argumentative,999,1085,They know something which are not incorporated in such materials as books and webpages,essay295,2162
Argumentative,1093,1264,"I, in my class, often communicate with my teacher to find a coordinated answer to a my faced problem, and my classmates are so accustomed to communicating with the teacher",essay295,2162
Argumentative,602,681,learning with a teacher is that you can ask about problems related your studies,essay295,2162
Argumentative,1351,1453,We can accomplish our assignments with little help of a teacher within less time than do it by ourself,essay295,2162
Argumentative,1468,1533,the teachers play important role in leading us to right direction,essay295,2162
Argumentative,1545,1620,This gives us opportunity to rise our educational level to an exited degree,essay295,2162
Argumentative,1622,1679,knowledge may be thereby better improved and strengthened,essay295,2162
Argumentative,1289,1349,the learning with a teacher is more efficient than by myself,essay295,2162
Non-Argumentative,0,57,Learning with a teacher is more efficient than by myself.,essay295,2162
Non-Argumentative,58,145,Every person learn in their own manner which they think that is most expedient to them.,essay295,2162
Non-Argumentative,146,206,"As for the learning by yourself, it has some certain profit.",essay295,2162
Non-Argumentative,207,373,"It gives you a chance to concentrate on what you learn cause there is no one who distracts your attention in presence of you, and your learning becomes more profound.",essay295,2162
Non-Argumentative,374,497,"In addition, the learning with a teacher makes us bear more burdens of studies cause they assign us homework, Nevertheless,",essay295,2162
Non-Argumentative,560,599,"Firstly, The distinguishing fact of the",essay295,2162
Non-Argumentative,682,697,"In other words,",essay295,2162
Non-Argumentative,859,871,"In addition,",essay295,2162
Non-Argumentative,1086,1091,Hence,essay295,2162
Non-Argumentative,1265,1286,"Secondly, in my mind,",essay295,2162
Non-Argumentative,1454,1466,"Furthermore,",essay295,2162
Non-Argumentative,1534,1543,"Moreover,",essay295,2162
Non-Argumentative,1680,1699,"Finally, of course,",essay295,2162
Non-Argumentative,1742,1781,Notable one of the shortcomings is that,essay295,2162
Non-Argumentative,1933,1945,I think that,essay295,2162
Non-Argumentative,2091,2096,Hence,essay295,2162
Argumentative,1865,1914,technologies allowed us to have a convenient life,essay296,1992
Argumentative,1916,1991,it has made our lives more chaotic according to the reasons mentioned above,essay296,1992
Argumentative,505,549,technologies made our lives more complicated,essay296,1992
Argumentative,666,704,it takes time for people to adapt them,essay296,1992
Argumentative,712,793,we are informed with devices that are produced with new features nearly every day,essay296,1992
Argumentative,795,821,many people often get lost,essay296,1992
Argumentative,837,887,I use new Iphone which I personally think is great,essay296,1992
Argumentative,898,999,"even though I used it for couple months, I still do not know how to use all the features proficiently",essay296,1992
Argumentative,1011,1074,"I tried to go through all the instructions but, soon, I gave up",essay296,1992
Argumentative,1083,1159,I found out that it is time-consuming and there are too many things to learn,essay296,1992
Argumentative,622,655,new technologies are always great,essay296,1992
Argumentative,1270,1316,they created their own language to communicate,essay296,1992
Argumentative,1213,1268,people used computers or cellphones to chat with others,essay296,1992
Argumentative,1326,1372,people try to type as fast as they are talking,essay296,1992
Argumentative,1374,1425,they use a lot of abbreviations and broken language,essay296,1992
Argumentative,1427,1484,"This has gotten worse with twitter, myspace, and facebook",essay296,1992
Argumentative,1486,1617,"What are even worse, young people who are still in the early ages are exposed to them and impeded by the newly developed inventions",essay296,1992
Argumentative,1631,1762,my younger brother does not know how to spell the words correctly and he talks to his friends with terms that I have never heard of,essay296,1992
Argumentative,1764,1854,I have tried to correct him for couple times but he just thinks that I am too conservative,essay296,1992
Argumentative,1168,1200,technology destroys the language,essay296,1992
Non-Argumentative,0,156,"Technology designed to make people's lives simpler often make them more complicated

Many people think they are blessed to be in the era of high technology.",essay296,1992
Non-Argumentative,157,257,"With newly developing technologies, people are able to carry various tasks more convenient and easy.",essay296,1992
Non-Argumentative,258,371,"For example, we no longer have to travel to DMV to renew our driver's license or drive to bank for sending money.",essay296,1992
Non-Argumentative,372,435,Ancient people would probably think that we are like magicians.,essay296,1992
Non-Argumentative,436,504,"However, even with all the conveniences, we would have to admit that",essay296,1992
Non-Argumentative,550,609,There are couple reasons and examples to support my answer.,essay296,1992
Non-Argumentative,610,620,"Of course,",essay296,1992
Non-Argumentative,656,664,"However,",essay296,1992
Non-Argumentative,705,710,Since,essay296,1992
Non-Argumentative,822,835,"For instance,",essay296,1992
Non-Argumentative,888,896,"However,",essay296,1992
Non-Argumentative,1000,1009,"At first,",essay296,1992
Non-Argumentative,1075,1082,because,essay296,1992
Non-Argumentative,1160,1165,"Next,",essay296,1992
Non-Argumentative,1201,1211,Ever since,essay296,1992
Non-Argumentative,1317,1324,Because,essay296,1992
Non-Argumentative,1618,1629,"To clarify,",essay296,1992
Non-Argumentative,1855,1863,Although,essay296,1992
Argumentative,277,331,online classes should never replace classroom learning,essay297,2141
Argumentative,2063,2140,the classroom learning is the best way to provide education for these reasons,essay297,2141
Argumentative,462,525,In the classroom environment you can learn from your classmates,essay297,2141
Argumentative,535,652,"if you see any of your classmates who is performing better, it will force you for making your performance more better",essay297,2141
Argumentative,667,858,"When I was in First Year in B Com, I was not serious in my study, but when I saw some of my friends who took better grades than me, it influenced me and I intended to do better in my subjects",essay297,2141
Argumentative,868,896,I got 1st rank in final exam,essay297,2141
Argumentative,377,460,classroom learning is the best way to provide education comparing to online classes,essay297,2141
Argumentative,969,1015,It makes you perfect in time management skills,essay297,2141
Argumentative,906,967,in classroom learning you have to complete study work on time,essay297,2141
Argumentative,1026,1104,you can learn by participating in group studies how to communicate with others,essay297,2141
Argumentative,1106,1217,"It makes you communication and of course your group skills better, which can help you in your future and career",essay297,2141
Argumentative,1522,1539,you learn quickly,essay297,2141
Argumentative,1226,1390,"professors play vital role in classroom learning, most of them are specialists is their subjects, and they help you by giving valuable information and useful skills",essay297,2141
Argumentative,1392,1510,"You can improve your skills by work under any professor; you can ask questions face to face, it will clear your doubts",essay297,2141
Argumentative,1585,1833,"For Toefl IBT Coaching first I was depend on some online courses, but after 1 month I realized that I was wasting my time so I joined an institute for preparation of Toefl IBT, and in 1 month I felt that my English skills have been improving faster",essay297,2141
Argumentative,1856,1930,online classes have some advantages so they could be used as supplementary,essay297,2141
Argumentative,1936,1995,they could not be substitute of existing classroom learning,essay297,2141
Non-Argumentative,0,226,"Classroom learnng vs online education

There are some people who believe that distance learning and online computer classes should replace classroom learning while there are some people who strongly disagree with this opinion.",essay297,2141
Non-Argumentative,227,276,"As far as I am concerned, I strongly believe that",essay297,2141
Non-Argumentative,332,361,I list my reasons as follows.,essay297,2141
Non-Argumentative,362,375,"First, indeed",essay297,2141
Non-Argumentative,526,533,because,essay297,2141
Non-Argumentative,653,665,"For example,",essay297,2141
Non-Argumentative,859,866,Finally,essay297,2141
Non-Argumentative,897,904,"Second,",essay297,2141
Non-Argumentative,1016,1024,Moreover,essay297,2141
Non-Argumentative,1218,1224,"Third,",essay297,2141
Non-Argumentative,1511,1520,In result,essay297,2141
Non-Argumentative,1540,1583,"For example, I have my personal experience.",essay297,2141
Non-Argumentative,1834,1854,It's undeniable that,essay297,2141
Non-Argumentative,1931,1934,but,essay297,2141
Non-Argumentative,1996,2060,"From the discussed above, we can easily draw the conclusion that",essay297,2141
Argumentative,327,406,it is good for a teenager to do a part time job while he/she is still a student,essay298,2173
Argumentative,2017,2056,part time job will be good for students,essay298,2173
Argumentative,1863,1904,it can destruct students from their study,essay298,2173
Argumentative,1918,1994,i did part time job in my high school and it did not hurt my academic result,essay298,2173
Argumentative,546,639,"Students can learn about time management, money management and convince people by their words",essay298,2173
Argumentative,654,727,when I was in my high school I worked as a sales-man in a shop for a year,essay298,2173
Argumentative,785,820,i had to manage my time efficiently,essay298,2173
Argumentative,729,772,As i had to spend some of my time in my job,essay298,2173
Argumentative,822,883,I had to manage my boss as well as had to prepare my homework,essay298,2173
Argumentative,885,969,This taught me how to manage time efficiently and do any job quickly and effectively,essay298,2173
Argumentative,981,1005,I learn money management,essay298,2173
Argumentative,1007,1089,"When my boss was out of the shop, i had to manage the accounts section of the shop",essay298,2173
Argumentative,1091,1141,"From this i learned, how to manage money correctly",essay298,2173
Argumentative,1143,1228,"This experience taught me, doing part time job can help students to learn many things",essay298,2173
Argumentative,460,544,"students can learn lots of things from part time job, before starting their real job",essay298,2173
Argumentative,1253,1326,"from part time jobs students can earn money, which can help their parents",essay298,2173
Argumentative,1674,1761,part time job can help students earn money and which can help their parents financially,essay298,2173
Argumentative,1499,1564,"By tutoring them, i earned some money and bought me books with it",essay298,2173
Argumentative,1576,1656,after taking that part time job i stopped taking my pocket money form my parents,essay298,2173
Non-Argumentative,0,129,"Part time job for teenage students

When we talk about student, we generally mean a boy or a girl who study in school or college.",essay298,2173
Non-Argumentative,130,229,"In some country, teenage students have the opportunity to do some part time job beside their study.",essay298,2173
Non-Argumentative,230,314,"However, some people do not support the concept of teenagers doing job beside study.",essay298,2173
Non-Argumentative,315,326,"In my view,",essay298,2173
Non-Argumentative,407,435,and this is for two reasons.,essay298,2173
Non-Argumentative,436,459,The main reason is that,essay298,2173
Non-Argumentative,640,652,"For example,",essay298,2173
Non-Argumentative,773,783,"therefore,",essay298,2173
Non-Argumentative,970,979,"Moreover,",essay298,2173
Non-Argumentative,1229,1251,Another reason is that,essay298,2173
Non-Argumentative,1327,1392,"For instance, when i was in high school I worked as a home tutor.",essay298,2173
Non-Argumentative,1393,1434,I taught math to two kids of my neighbor.,essay298,2173
Non-Argumentative,1435,1497,I helped them to understand the difficult topics of the books.,essay298,2173
Non-Argumentative,1565,1574,"Moreover,",essay298,2173
Non-Argumentative,1657,1672,"As you can see,",essay298,2173
Non-Argumentative,1762,1844,"In sum, I am sure; some people will oppose the idea of part time job for students.",essay298,2173
Non-Argumentative,1845,1861,"They will argue,",essay298,2173
Non-Argumentative,1905,1916,"However, as",essay298,2173
Non-Argumentative,1995,2015,"therefore, i believe",essay298,2173
Non-Argumentative,2057,2172,Every Student should do part time job beside their study if they want to prepare more efficiently for their future.,essay298,2173
Argumentative,354,420,its better that people learn foreign language in their own country,essay299,1817
Argumentative,1648,1720,it is better for people to learn a foreign language in their own country,essay299,1817
Argumentative,1722,1816,It is cost effective and there is a pool of opportunities available now to accomplish the same,essay299,1817
Argumentative,666,750,"In the earlier periods, it was not easy to find a teacher to learn a foreign languge",essay299,1817
Argumentative,756,840,"with the advent of globalization, one can easily find a teacher in their own country",essay299,1817
Argumentative,855,987,"in Indian sub-continent there are large number of centers opened for getting trained in variety of languages like french, german etc",essay299,1817
Argumentative,519,605,it is not possible for everyone to visit a foreign country to learn a foreign language,essay299,1817
Argumentative,609,664,it requires large amount of money and legal formalities,essay299,1817
Argumentative,1184,1237,it is very easy to learn a foreign in our own country,essay299,1817
Argumentative,1094,1178,Students can choose any language from the set of languages available at a university,essay299,1817
Argumentative,997,1092,colleges and universities have introduced foreign language course as a part of their curriculum,essay299,1817
Argumentative,1245,1341,highly qualified foreign language teachers are easily accessible in various schools and colleges,essay299,1817
Argumentative,1472,1635,A large number of foreign language courses are available online and there are various forums where people can discuss their problems on different foreign languages,essay299,1817
Argumentative,1350,1470,technology has also played a great role in reducing the separation between learning a foreign languge in our own country,essay299,1817
Non-Argumentative,0,16,Which is better-,essay299,1817
Non-Argumentative,17,67,Learning foreign language in home or host country?,essay299,1817
Non-Argumentative,68,136,Our World has varied cultures and each culture has its own language.,essay299,1817
Non-Argumentative,137,338,It has become essential for a person to learn at least one foreign language as one do interacts with foreigners once in a lifetime and learning a foreign langauge adds on to a person skill-set as well.,essay299,1817
Non-Argumentative,339,352,"Also, I think",essay299,1817
Non-Argumentative,421,503,The reasons for holding that opinion are illustrated in the subsequent paragraphs.,essay299,1817
Non-Argumentative,504,517,"First of all,",essay299,1817
Non-Argumentative,606,608,as,essay299,1817
Non-Argumentative,751,754,But,essay299,1817
Non-Argumentative,841,853,"For example,",essay299,1817
Non-Argumentative,988,995,"Second,",essay299,1817
Non-Argumentative,1179,1182,"So,",essay299,1817
Non-Argumentative,1238,1243,"Also,",essay299,1817
Non-Argumentative,1342,1348,"Third,",essay299,1817
Non-Argumentative,1636,1646,"To sum up,",essay299,1817
Argumentative,509,595,i discern that several small breaks will help students to be active in their academics,essay300,2419
Argumentative,2332,2418,schools should consider giving several small vocations to the students during the year,essay300,2419
Argumentative,2129,2320,"it not only provide break to them from their regular commitment but also allows them to spend some time on themselves, heel stressful mind and boost desire of resuming to the regular schedule",essay300,2419
Argumentative,2038,2124,Vacations are not only required by students but also by professionals and housekeepers,essay300,2419
Argumentative,606,682,several vacations throughout the year will keep stress level of students low,essay300,2419
Argumentative,1439,1509,students learning capability increase after having refreshing vacation,essay300,2419
Argumentative,684,801,Many educational bodies schedule its small vacations after term exams so that student's get relief form exam pressure,essay300,2419
Argumentative,812,969,"research done by universities proves that student's performance improves if they get regular breaks from their learning, preparation and examination schedule",essay300,2419
Argumentative,971,1146,Many colleges in foreign countries provide vacations to students after each semester that facilitate student to entertain themselves as well as prepare for their next semester,essay300,2419
Argumentative,1153,1317,several holidays aid these students to not only amuse themselves but also arrange fund and materials such as books and references material for their upcoming course,essay300,2419
Argumentative,1533,1604,in my school we used to get several vacations after our quarterly exams,essay300,2419
Argumentative,1606,1768,During those vacations i used to analyze my performance in latest examination and used to go through those question or concept again to avoid making same mistakes,essay300,2419
Argumentative,1770,1871,I also used to spend my time on developing some recreational activity or learning some sports or game,essay300,2419
Argumentative,1873,2036,"During my all vacations, I used to miss my school due to which I used to restart my session with great enthusiasm of learning and scoring good marks in new quarter",essay300,2419
Non-Argumentative,0,178,"One long vacation or several long vacation

Everybody require some break from their tight schedules likewise students also require vacation form their intense academic schedules.",essay300,2419
Non-Argumentative,179,336,Many people promote one long vacation system of the school because it would help student to start their course or academic year with strong zeal of learning.,essay300,2419
Non-Argumentative,337,450,"So other several, prefer numbers of short breaks during the year so that student can get rejuvenate periodically.",essay300,2419
Non-Argumentative,451,499,In both the scenario students relief themselves.,essay300,2419
Non-Argumentative,500,508,"However,",essay300,2419
Non-Argumentative,596,604,"Firstly,",essay300,2419
Non-Argumentative,802,810,"However,",essay300,2419
Non-Argumentative,1147,1151,Also,essay300,2419
Non-Argumentative,1318,1422,"Secondly, scientific research provide several authentic survey of the students' performance after break.",essay300,2419
Non-Argumentative,1423,1437,It states that,essay300,2419
Non-Argumentative,1510,1531,"To quote an instance,",essay300,2419
Non-Argumentative,2125,2127,As,essay300,2419
Non-Argumentative,2321,2330,Therefore,essay300,2419
Argumentative,300,346,saving some part of your earnings is essential,essay302,1920
Argumentative,368,522,"you can not predict future developments, neither in your professional nor your personal life, furthermore with savings you can fulfill some of your dreams",essay302,1920
Argumentative,925,1002,they had to move back in with their families and they lost their independence,essay302,1920
Argumentative,890,920,They could not afford the rent,essay302,1920
Argumentative,766,855,I remember some friends who lost their jobs recently due to the economic crisis in Europe,essay302,1920
Argumentative,595,753,The global economic conditions in these days are tough and there are many unpredictable factors that make it necessary to have some money on your bank account,essay302,1920
Argumentative,531,593,there are several uncertainties about your professional future,essay302,1920
Argumentative,1082,1192,It is possible that in the future you have some unavoidable expenses that you could not afford without savings,essay302,1920
Argumentative,1017,1080,you can not be sure about the development in your personal life,essay302,1920
